Unnamed: 0,Artist,Url_spotify,Track,Album,Album_type,Uri,Danceability,Energy,Key,Loudness,Speechiness,Acousticness,Instrumentalness,Liveness,Valence,Tempo,Duration_ms,Url_youtube,Title,Channel,Views,Likes,Comments,Description,Licensed,official_video,Stream,Genre
5000,Ennio Morricone,https://open.spotify.com/artist/1nIUhcKHnK6iyumRyoV68C,"The Good, The Bad and The Ugly - Il Buono, Il Brutto, Il Cattivo (Titles)","The Good, The Bad and The Ugly (Original Motion Picture Soundtrack) [Remastered Edition]",album,spotify:track:2IJJszwGK4NWmh3bNK6CPD,0.326,0.895,2.0,-4.987,0.139,0.626,0.843,0.109,0.0679,107.613,162387.0,https://www.youtube.com/watch?v=ZylbA374VRw,"Ennio Morricone - The Good, The Bad and The Ugly (titles) - Il Buono, Il Brutto E Il Cattivo (1966)",Ennio Morricone,2204442.0,24465.0,476.0,"Ennio Morricone - (Il Buono, Il Brutto E Il Cattivo - The Good, The Bad And The Ugly Soundtrack) - 1966
Subscribe to hear great music from the master Ennio Morricone http://bit.ly/1rw9u8m 
Don’t miss all the Greatest Hits and Beautiful Soundtracks by the Legendary Composer and Academy Award Winner Ennio Morricone.
Listen to Ennio Morricone’s Amazing Soundtrack THE GOOD, THE BAD, THE UGLY
Ascoltate l’iconica Colonna Sonora di IL BUONO, IL BRUTTO E IL CATTIVO http://bit.ly/1UakzlZ
Learn all the latest news from The Master here:
https://www.facebook.com/maestroenniomorricone
http://www.enniomorricone.org/",False,True,27368908.0,Error
5001,Ennio Morricone,https://open.spotify.com/artist/1nIUhcKHnK6iyumRyoV68C,On Earth As It Is In Heaven,The Mission: Music From The Motion Picture,album,spotify:track:0DefmqHMWLchBf3VyLTYKq,0.424,0.212,2.0,-19.552,0.0275,0.967,0.958,0.0482,0.183,96.107,230693.0,https://www.youtube.com/watch?v=3V8aZLTpKXo,Ennio Morricone - On Earth as it is in Heaven (In Concerto - Venezia 10.11.07),SelfDistribuzione,1346696.0,8468.0,365.0,"Song taken from ""Mission"", performed in the magical setting of San Marco's square in Venice and directed by Ennio Morricone himself.

Brano tratto da ""Mission"", eseguito nella magica cornice di piazza San Marco a Venezia e diretto dallo stesso Ennio Morricone.",True,True,14432193.0,film score
5002,Seu Jorge,https://open.spotify.com/artist/0i1s9WcIu0PrUvHzALgofo,Amiga da Minha Mulher,"Musica para Churrasco, Vol. 1",album,spotify:track:6TVmNRrCRzU3NlyuubLIzZ,0.788,0.916,9.0,-5.152,0.121,0.714,0.0,0.0867,0.828,104.013,248080.0,https://www.youtube.com/watch?v=Iw3nkmhC20Y,ROBERTO CARLOS & SEU JORGE - AMIGA DA MINHA MULHER 2012 (RC Especial) - HD,Wild in Heart,4924599.0,,1617.0,"Um encontro pra lá de esperado, o nosso Rei Roberto Carlos recebe em seu Programa Especial o grande cantor e compositor Seu Jorge e juntos cantam ""Amiga da Minha Mulher"" sucesso atual na vóz do Seu Jorge e agora em dueto com o Rei que vale a pena assistir.",False,False,71194964.0,música popular brasileira
5003,Seu Jorge,https://open.spotify.com/artist/0i1s9WcIu0PrUvHzALgofo,Burguesinha,America Brasil,album,spotify:track:5iEEpVPlnH41wyAsYcON7w,0.682,0.949,2.0,-5.401,0.0422,0.563,0.00403,0.337,0.96,101.976,258187.0,https://www.youtube.com/watch?v=iusfiZUkhY4,Seu Jorge - Burguesinha,SeuJorgeVEVO,1682747.0,12900.0,321.0,Music video by Seu Jorge performing Burguesinha.,True,True,55692713.0,música popular brasileira
5004,Seu Jorge,https://open.spotify.com/artist/0i1s9WcIu0PrUvHzALgofo,Felicidade,"Musica para Churrasco, Vol. 2",album,spotify:track:2bDc2CMq7MMAURwnMJverx,0.549,0.81,2.0,-6.425,0.0398,0.342,0.0,0.203,0.806,113.819,267413.0,https://www.youtube.com/watch?v=fbnznYoUZ8w,Seu Jorge :Felicidade (Lyric Vídeo),Hugo br 72,72173.0,979.0,20.0,,False,False,36711513.0,música popular brasileira
5005,Seu Jorge,https://open.spotify.com/artist/0i1s9WcIu0PrUvHzALgofo,Mina do Condomínio,America Brasil,album,spotify:track:6Vfcu5p7cPcoVImKJ4gBhI,0.677,0.868,11.0,-4.313,0.0322,0.594,0.0,0.0967,0.966,95.994,400627.0,https://www.youtube.com/watch?v=hANTpQZwNE8,Seu Jorge  Mina Do Condomínio 1080p,ana,21951.0,504.0,13.0,bora pro samba,False,False,23637342.0,música popular brasileira
5006,Seu Jorge,https://open.spotify.com/artist/0i1s9WcIu0PrUvHzALgofo,É Isso Aí (The Blower'S Daughter),Ana E Jorge,album,spotify:track:6tvnj77OJD0DJTgSIi6fQ3,0.294,0.321,8.0,-8.783,0.0293,0.638,0.0,0.947,0.224,107.134,318027.0,https://www.youtube.com/watch?v=3rn2N0ZbLEQ,"Ana Carolina, Seu Jorge - É Isso Aí (The Blower's Daughter) (Ao Vivo)",anacarolinaVEVO,137545158.0,742310.0,22960.0,"O vídeo ao vivo de Ana Carolina e Seu Jorge para a música 'É Isso Aí'. Clique aqui para ouvir Ana Carolina no Spotify: http://smarturl.it/AnaCarolinaSpotify...
 
Você pode encontrar essa música no álbum Ana e Jorge. Clique para comprar a faixaou o álbum no iTunes: http://smarturl.it/AnaEJorge?IQid=AnaCEI
Google Play: http://smarturl.it/EIAGPlay?IQid=AnaCEI
Ouça mais músicas de Ana Carolina aqui: http://smarturl.it/AnaCarolinaStream?...
 
Mais de Ana Carolina
Confesso: https://youtu.be/rJBcIlhPuMI
Vai: https://youtu.be/CqLEcfC6yg4
Encostar Na Tua: https://youtu.be/C4_8DbsL5M8
 
Ouça grandes sucessos de música MPB aqui: http://smarturl.it/SoMPB?IQid=AnaCEI
 
Siga Ana Carolina
Site Oficial: http://ana-carolina.com/
Facebook:https://www.facebook.com/anacarolinao...
Twitter: https://twitter.com/sigaanacarolina
Instagram: https://instagram.com/sigaanacarolina/

Assine o canal de Ana Carolina no YouTube: http://smarturl.it/AnaCarolinaSub?IQi...

---------

Letras:

É isso aí
Como a gente achou que ia ser
A vida tão simples é boa
Quase sempre

É isso aí
Os passos vão pelas ruas
Ninguém reparou na lua
A vida sempre continua

Eu não sei parar de te olhar
Eu não sei parar de te olhar
Não vou parar de te olhar
Eu não me canso de olhar
Não sei parar
De te olhar",True,True,41353830.0,música popular brasileira
5007,Seu Jorge,https://open.spotify.com/artist/0i1s9WcIu0PrUvHzALgofo,Final de Semana,Final de Semana,single,spotify:track:41sjmSYBlafAQrfcxt5387,0.795,0.502,4.0,-5.746,0.214,0.676,0.0,0.52,0.653,129.533,201683.0,https://www.youtube.com/watch?v=WCcYTWwCv00,"Papatinho - Final de Semana ft. Seu Jorge, Black Alien",Papatunes,7614632.0,117736.0,2425.0,"Videoclipe do single ""Final de Semana"" do Papatinho feat. Seu Jorge, Black Alien

Ficha técnica:

Autores: Papatinho, Seu Jorge, Black Alien, Califfa, Mun-Ra
Produção musical: Papatinho / @papatinho
Captação Black Alien: Chopp / @chopptn 
Estúdio: Papatunes Studios, Rio de Janeiro
Captação Seu Jorge :Bernardo Massot, Tofu Valsechi / @bernardomassot @tofuvalsechi
Estúdio: Sonido, São Paulo 
Arranjo de cordas: Rodrigo de Marsillac
Violinos: Pedro Mibielli 
Violoncello: Federico Puppi
Mix/master: 2F - UFLOW / @2f_uflow 

Gravadora: Warner Music 

Realização: Clã Filmes

Direção: Lucas Romor

Produção Executiva: Nil Souza
Ass Prod: Larissa Sampaio
Ass Prod: Eduardo Perobeli
Ass Prod: Bruna Gonçalles

Produção Artística: Bernardo Regazzi 

Direção Fotografia: Lucas Romor e Victor Ponce
OP Cam: Victor Ponce
1Ac: Lucci Antunes
2Ac: Carol Colombo
MotoCam: Laurent Refalo e Rafael Canal

Edição: Gabriel Bargmann

Direção de Arte: Keops e Raony
Contra Regra: Antonio Da Silva
Ass Contra Regra: Cauã Antonio da Silva

Make e Hair: Patricia Monaco

Stylist: Camila Monteiro e Fernanda Garca
Ass Stylist: Luiz Meira

Chefe de Elétrica: Jaja
1 Ass Elétrica: Christian
2 Ass Elétrica: Aratus
3 Ass Elétrica: Ficher

Apoio: Adidas / @adidasbrasil

Modelos:  Leticia Paola Lucena, Débora Rodrigues e  ngela Jussara.

Músicos Orquestra: Danilo Pereira, Bruno Ronaldo, Jeff Moura, Jessica Campelo e Camila Helany

Segurança: Gutierrez

Transporte: JR Transportes

Equipamentos: VP cine, 22 acessórios e EliteStock.


#Papatinho #SeuJorge #BlackAlien


Letra

Liguei pro Papatinho perguntando se ele tinha uma batida pra mim, uma batida pra mim.
Como sempre, ele demorou a responder
Mas chegou uma mensagem falando “qualé neguinho, chega aê...e vamo ver qual vai ser”

É uma mistura de samba com rap
baile de favela com pagode e boombap
na medida pra fazer seu corpo todo mexer

Quando bate o grave ela desce gostoso
Toca na boate e ela pede de novo
Já falei que é disso que elas gostam e vou te explicar porquê

Final de semana
ela vai pra rua
Curtir um TrapSamba
balançando a lua
Seu corpo não é quadro, mas
eu quero ser moldura.
Vamos lá pra casa,
que hoje eu tô na tua.

Oi morena, que bom revê-la
Vêm com o papi mammy mammy 
Sob a luz das estrelas
Sem a nóia do holofote, ela dá o bote
Pede uns tapas, só de capa, ninguém quer filhote
Hmm, 
Sem energia nos postes
Brilha no escuro, energia no esporte
Tranquila na tequila, à vontade no shot
O pai de sensimilla à vontade de short
Ohh que delícia esse cheirinho no cangote
Solicitou a perícia ao perito, 
Ohh lord!
É offline que o bagulho fica louco
Ela vem e vai, eu quero tudo e mais um pouco
Hoje eu tô na sua baby, você tá na minha
Balançando a lua, acordando a vizinha
Cachorro late a gata mia, nem um pio
Shhhh!!! 
Em cima da pia da cozinha",True,True,24994895.0,música popular brasileira
5008,Seu Jorge,https://open.spotify.com/artist/0i1s9WcIu0PrUvHzALgofo,Vou Festejar,"Sambabook Jorge Aragão, Vol. 2",compilation,spotify:track:2r4zhMrN1cQEXNWNG2SkXW,0.46,0.615,11.0,-9.581,0.0857,0.495,0.0,0.119,0.823,97.982,199560.0,https://www.youtube.com/watch?v=N5cUaW3VffY,Vou Festejar - Jorge Aragão e Convidados (Sambabook Jorge Aragão),Sambabook,1141289.0,15344.0,411.0,"Em 2016, ano do centenário do samba, o Sambabook chegou à sua quinta edição e comemorou o sucesso absoluto das quatro edições anteriores que homenagearam as obras de João Nogueira, Martinho da Vila, Zeca Pagodinho e Dona Ivone Lara. O reverenciado da vez foi ninguém menos que o grande poeta do samba Jorge Aragão, que naquele ano celebrava 40 anos de carreira. 
 
Ouça/Baixe: http://smarturl.it/SambabookJAPlayers

------------------------------------------
Vou festejar ( Jorge Aragão/ Neoci Dias / Dida)

Chora, não vou ligar
Chegou a hora
Vais me pagar
Pode chorar, pode chorar

É o teu castigo
Brigou comigo
Sem ter por quê
Eu vou festejar, vou festejar
O teu sofrer, o teu penar

Você pagou com traição
A quem sempre lhe deu a mão
Você pagou com traição
A quem sempre lhe deu a mão",True,True,6191893.0,música popular brasileira
5009,Seu Jorge,https://open.spotify.com/artist/0i1s9WcIu0PrUvHzALgofo,Clube do Samba,"Sambabook João Nogueira, 2",compilation,spotify:track:6NV8IxFmG9cPtnZqQwulAy,0.614,0.749,11.0,-9.502,0.283,0.375,0.0,0.666,0.78,105.169,278853.0,https://www.youtube.com/watch?v=B0knGzVC_M4,DVD Seu Jorge - Músicas para Churrasco - Ao Vivo Na Quinta da Boa Vista,Paulo Victor,132649.0,1553.0,44.0,"1. Dia de Comemorar
• 2. Mina do Condomínio
• 3. Chega No Swingue
• 4. A Doida
• 5. Vizinha - Part. Alexandre Pires
• 6. Eu Sou o Samba - Part. Alexandre Pires
• 7. Meu Parceiro - Part. Zeca Pagodinho
• 8. Lua de Ogum - Part. Zeca Pagodinho
• 9. Judia de Mim - Part. Zeca Pagodinho
• 10. Hei de Guardar Teu Nome / Vou lhe Deixar No Sereno / Quem Sorriu Foi a Patroa / Bagaço da Laranja - Part. Zeca Pagodinho
• 11. Deixa a Vida Me Levar - Part. Zeca Pagodinho
• 12. São Gonça - Part. Caetano Veloso
• 13. Desde Que o Samba é Samba - Part. Caetano Veloso
• 14. Dois Beijinhos - Part. Flor de Maria
• 15. Quem Não Quer Sou Eu
• 16. Carolina
• 17. Preto do Beco - Part. Trio Preto + 1
• 18. Zé do Caroço
• 19. Diário de Um Detento - Part. Racionais MC's
• 20. Negro Drama - Part. Racionais MC's
• 21. Olhos Coloridos - Part. Sandra de Sá
• 22. Quem Sorriu Foi a Patroa
• 23. Lua de Ogum
• 24. Uma Prova de Amor
• 25. Meu Parceiro
• 26. Burguesinha
• 27. Diário de um Detento - Part. Racionais MC's
• 28. Zé do Caroço
• 29. A Carne
• 30. Mina do Condomínio
• 31. Vizinha
• 32. Imperador da Dança
• 33. Dois Beijinhos
• 34. Dia de Comemorar
• 35. Mina do Condomínio
• 36. Ilariê",False,False,23335006.0,música popular brasileira
5010,Seu Jorge,https://open.spotify.com/artist/0i1s9WcIu0PrUvHzALgofo,Mina do Condomínio (Ao Vivo),"Musicas para Churrasco, Vol.1 (Ao Vivo) (Delux Edition)",album,spotify:track:6DZZwZqSwvOAdv4LlLk3mu,0.672,0.964,11.0,-5.276,0.046,0.213,3.4e-06,0.39,0.824,107.976,346680.0,https://www.youtube.com/watch?v=hANTpQZwNE8,Seu Jorge  Mina Do Condomínio 1080p,ana,21951.0,504.0,13.0,bora pro samba,False,False,15906788.0,música popular brasileira
5011,Seu Jorge,https://open.spotify.com/artist/0i1s9WcIu0PrUvHzALgofo,São Gonça,Ana E Jorge,album,spotify:track:30lKTJnxHqfD1UeiAn0BLD,0.493,0.537,7.0,-7.887,0.0493,0.781,0.0,0.982,0.507,109.541,297067.0,https://www.youtube.com/watch?v=Ll99lcYLMIU,Seu Jorge - São Gonça (Ao Vivo),anacarolinaVEVO,18086330.0,124077.0,1865.0,"O vídeo oficial de Seu Jorge para a música 'São Gonça'. Clique aqui para ouvir Seu Jorge no Spotify: http://smarturl.it/SeuJSpotify?IQid=SeuJSao
 
Você pode encontrar essa música no álbum América Brasil. Clique para comprar a faixa ou o álbum no iTunes: http://smarturl.it/SJorgeBrasiliTunes?IQid=SeuJSao
Google Play: http://smarturl.it/SeuJGoncaPlay?IQid=SeuJSao
Ouça mais músicas de Seu Jorge aqui: http://smarturl.it/SeuJorgeStream?IQid=SeuJSao
 
Ouça grandes sucessos de MPB aqui: http://smarturl.it/SoMPB?IQid=SeuJSao
 
Siga Seu Jorge 
Site Oficial: http://www.seujorge.com/
Facebook: https://www.facebook.com/SeuJorgeOficial
Twitter: https://twitter.com/soujorge
Instagram: https://instagram.com/seujorge_oficial/

---------

Letras:

Pretinha
Faço tudo pelo nosso amor
Faço tudo pelo bem de nosso bem (meu bem)
A saudade é minha dor
Que anda arrasando com meu coração
Não Duvide que um dia
Eu te darei o céu
Meu amor junto com um anel
Pra gente se casar
No cartório ou na igreja
Se você quiser
Se não quiser, tudo bem (meu bem)
Mas tente compreender
Morando em São Gonçalo você sabe como é
Hoje a tarde a ponte engarrafou
E eu fiquei a pé
Tentei ligar pra você
O orelhão da minha rua
Estava escangalhado
Meu cartão tava zerado
Mas você crê se quiser",True,True,14316304.0,música popular brasileira
5012,Leonard Cohen,https://open.spotify.com/artist/5l8VQNuIg0turYE1VtM9zV,Suzanne,Songs Of Leonard Cohen,album,spotify:track:2L93TdW2GMue1H2zlkt30F,0.409,0.172,6.0,-16.44,0.0389,0.922,0.00112,0.111,0.352,132.151,229293.0,https://www.youtube.com/watch?v=svitEEpI07E,Leonard Cohen - Suzanne (Audio),LeonardCohenVEVO,10448232.0,70868.0,2464.0,"Leonard Cohen - Suzanne (Official Audio)
Listen on Spotify:  http://smarturl.it/lc_spotify 
Listen on Apple Music:  http://smarturl.it/lc_apple 
Amazon:  http://smarturl.it/lc_amu 
YouTube Music:  http://smarturl.it/lc_ytm 

Facebook: https://www.facebook.com/leonardcohen
Instagram: https://www.instagram.com/leonardcohen/ 
Official Website: https://www.leonardcohen.com

Lyrics:

Suzanne takes you down to her place near the river
You can hear the boats go by
You can spend the night beside her
And you know that she's half crazy
But that's why you want to be there
And she feeds you tea and oranges
That come all the way from China
And just when you mean to tell her
That you have no love to give her
Then she gets you on her wavelength
And she lets the river answer
That you've always been her lover

And you want to travel with her
And you want to travel blind
And you know that she will trust you
For you've touched her perfect body with your mind

And Jesus was a sailor
When he walked upon the water
And he spent a long time watching
From his lonely wooden tower
And when he knew for certain
Only drowning men could see him
He said ""All men will be sailors then
Until the sea shall free them""
But he himself was broken
Long before the sky would open
Forsaken, almost human
He sank beneath your wisdom like a stone

And you want to travel with him
And you want to travel blind
And you think maybe you'll trust him
For he's touched your perfect body with his mind

Now Suzanne takes your hand
And she leads you to the river
She is wearing rags and feathers
From Salvation Army counters
And the sun pours down like honey
On Our Lady of the Harbour
And she shows you where to look
Among the garbage and the flowers
There are heroes in the seaweed
There are children in the morning
They are leaning out for love
And they will lean that way forever
While Suzanne holds the mirror

And you want to travel with her
And you want to travel blind
And you know you can trust her
For she's touched your perfect body with her mind",True,True,114623979.0,rock music
5013,Leonard Cohen,https://open.spotify.com/artist/5l8VQNuIg0turYE1VtM9zV,Hallelujah,Various Positions,album,spotify:track:7yzbimr8WVyAtBX3Eg6UL9,0.28,0.344,0.0,-12.577,0.0293,0.715,0.00642,0.133,0.232,171.143,277160.0,https://www.youtube.com/watch?v=YrLk4vdY28Q,Leonard Cohen - Hallelujah (Live In London),LeonardCohenVEVO,225385702.0,1125139.0,56058.0,"""Hallelujah"" by Leonard Cohen - Live In London
Listen to Leonard Cohen: https://LeonardCohen.lnk.to/listenYD
Watch more Leonard Cohen videos: https://LeonardCohen.lnk.to/listenYD/youtube

Subscribe to the official Leonard Cohen YouTube channel: https://LeonardCohen.lnk.to/subscribeYD

Followed Leonard Cohen:
Facebook: https://LeonardCohen.lnk.to/followFI
Instagram: https://LeonardCohen.lnk.to/followII
Twitter: https://LeonardCohen.lnk.to/followTI
Website: https://LeonardCohen.lnk.to/followWI
Spotify: https://LeonardCohen.lnk.to/followSI
YouTube: https://LeonardCohen.lnk.to/subscribeYD

Lyrics:
Hallelujah, Hallelujah
Hallelujah, Hallelujah

#Hallelujah #LeonardCohen #LiveInLondon",True,True,109391806.0,folk rock
5014,Leonard Cohen,https://open.spotify.com/artist/5l8VQNuIg0turYE1VtM9zV,You Want It Darker,You Want It Darker,album,spotify:track:5zb7npjQqoJ7Kcpq4yD9qn,0.674,0.327,4.0,-16.986,0.0574,0.613,0.199,0.0756,0.494,108.995,284373.0,https://www.youtube.com/watch?v=v0nmHymgM7Y,Leonard Cohen - You Want It Darker (Audio),LeonardCohenVEVO,23570350.0,188733.0,10473.0,"Leonard Cohen - You Want It Darker (Official Audio)
Listen on Spotify:  http://smarturl.it/lc_spotify 
Listen on Apple Music:  http://smarturl.it/lc_apple 
Amazon:  http://smarturl.it/lc_amu 
YouTube Music:  http://smarturl.it/lc_ytm 

Facebook: https://www.facebook.com/leonardcohen
Instagram: https://www.instagram.com/leonardcohen/ 
Official Website: https://www.leonardcohen.com
 
Lyrics:

If you are the dealer
I'm out of the game
If you are the healer
It means I'm broken and lame
If thine is the glory then
Mine must be the shame
You want it darker
We kill the flame

Magnified, sanctified
Be thy holy name
Vilified, crucified
In the human frame
A million candles burning
For the help that never came
You want it darker

Hineni, hineni
I'm ready, my Lord

There's a lover in the story
But the story's still the same
There's a lullaby for suffering
And a paradox to blame
But it's written in the scriptures
And it's not some idle claim
You want it darker
We kill the flame

They're lining up the prisoners
And the guards are taking aim
I struggled with some demons
They were middle-class and tame
I didn't know I had permission
To murder and to maim
You want it darker

Hineni, hineni
I'm ready, my Lord

Magnified, sanctified
Be thy holy name
Vilified, crucified
In the human frame
A million candles burning
For the love that never came
You want it darker
We kill the flame

If you are the dealer
Let me out of the game
If you are the healer
I'm broken and lame
If thine is the glory
Mine must be the shame
You want it darker

Hineni, hineni
Hineni, hineni
I'm ready, my Lord

Hineni
Hineni, hineni
Hineni",True,True,62532499.0,rock music
5015,Leonard Cohen,https://open.spotify.com/artist/5l8VQNuIg0turYE1VtM9zV,Dance Me to the End of Love,Various Positions,album,spotify:track:3mFzIFFFmEXTQs6BDAK2ZZ,0.588,0.38,7.0,-11.879,0.0251,0.269,8.36e-06,0.0741,0.502,132.885,280627.0,https://www.youtube.com/watch?v=NGorjBVag0I,Leonard Cohen - Dance Me to the End of Love (Official Video),LeonardCohenVEVO,159890161.0,821190.0,24568.0,"Watch the official video for “Dance Me to the End of Love” by Leonard Cohen
Listen to Leonard Cohen: https://LeonardCohen.lnk.to/listenYD 
 
Subscribe to the official Leonard Cohen YouTube channel: https://LeonardCohen.lnk.to/subscribeYD
 
Watch more Leonard Cohen videos: https://LeonardCohen.lnk.to/listenYD/youtube
 
Follow Leonard Cohen:
Facebook: https://LeonardCohen.lnk.to/followFI
Instagram: https://LeonardCohen.lnk.to/followII 
Website: https://LeonardCohen.lnk.to/followWI 
Spotify: https://LeonardCohen.lnk.to/followSI 
 
#LeonardCohen #DanceMeToTheEndOfLove


Lyrics:

Dance me to your beauty with a burning violin
Dance me through the panic 'til I'm gathered safely in
Lift me like an olive branch and be my homeward dove
Dance me to the end of love
Dance me to the end of love

Oh let me see your beauty when the witnesses are gone
Let me feel you moving like they do in Babylon
Show me slowly what I only know the limits of
Oh dance me to the end of love
Dance me to the end of love

Dance me to the wedding now, oh dance me on and on
Dance me very tenderly and dance me very long
We're both of us beneath our love, we're both of us above
Dance me to the end of love
Dance me to the end of love

Dance me to the children who are asking to be born
Dance me through the curtains that our kisses have outworn
Raise a tent of shelter now, though every thread is torn
Dance me to the end of love

Dance me to your beauty with a burning violin
Dance me through the panic 'til I'm gathered safely in
Touch me with your naked hand, touch me with your glove
Dance me to the end of love
Dance me to the end of love
Dance me to the end of love",True,True,48887738.0,folk rock
5016,Leonard Cohen,https://open.spotify.com/artist/5l8VQNuIg0turYE1VtM9zV,Famous Blue Raincoat,Songs Of Love And Hate,album,spotify:track:77K5TB5KZmDZCoJCdd1NvE,0.474,0.0404,9.0,-22.208,0.0387,0.948,0.000263,0.111,0.18,119.415,310773.0,https://www.youtube.com/watch?v=ohk3DP5fMCg,Leonard Cohen - Famous Blue Raincoat (Audio),LeonardCohenVEVO,4300282.0,40610.0,1276.0,"Leonard Cohen - Famous Blue Raincoat (Official Audio)
Listen on Spotify:  http://smarturl.it/lc_spotify 
Listen on Apple Music:  http://smarturl.it/lc_apple 
Amazon:  http://smarturl.it/lc_amu 
YouTube Music:  http://smarturl.it/lc_ytm 

Facebook: https://www.facebook.com/leonardcohen
Instagram: https://www.instagram.com/leonardcohen/ 
Official Website: https://www.leonardcohen.com 

Lyrics:

It's four in the morning, the end of December
I'm writing you now just to see if you're better
New York is cold, but I like where I'm living
There's music on Clinton Street all through the evening

I hear that you're building your little house deep in the desert
You're living for nothing now. I hope you're keeping some kind of record

Yes, and Jane came by with a lock of your hair
She said that you gave it to her
That night that you planned to go clear
Did you ever go clear?

Oh, the last time we saw you you looked so much older
Your famous blue raincoat was torn at the shoulder
You'd been to the station to meet every train
But then you came home without Lili Marlene

And you treated my woman to a flake of your life
And when she came back she was nobody's wife

I see you there with the rose in your teeth
One more thin gypsy thief
Well I see Jane's awake
She sends her regard

And what can I tell you my brother, my killer?
What can I possibly say?
I guess that I miss you. I guess I forgive you
I'm glad you stood in my way

If you ever come by here
For Jane or for me
Well, your enemy is sleeping
And his woman is free

Yes, and thanks for the trouble you took from her eyes
I thought it was there for good so I never tried

And Jane came by with a lock of your hair
She said that you gave it to her
That night that you planned to go clear

Sincerely, L. Cohen",True,True,56932454.0,rock music
5017,Leonard Cohen,https://open.spotify.com/artist/5l8VQNuIg0turYE1VtM9zV,"So Long, Marianne",Songs Of Leonard Cohen,album,spotify:track:14CsqOaDkOkrZ49UJLtuOJ,0.543,0.395,9.0,-11.396,0.0267,0.701,4.24e-05,0.0961,0.231,94.872,340560.0,https://www.youtube.com/watch?v=aLOnQmmmlkw,"So long, Marianne Leonard Cohen",nick tsourmas,3676494.0,21677.0,1047.0,Επιμέλεια βίντεο : Ν.Τ.,False,False,54494351.0,rock music
5018,Leonard Cohen,https://open.spotify.com/artist/5l8VQNuIg0turYE1VtM9zV,I'm Your Man,I'm Your Man,album,spotify:track:5atFAXIgMXP378op4FaxBm,0.712,0.308,11.0,-16.003,0.036,0.328,0.0,0.0835,0.5,94.123,265187.0,https://www.youtube.com/watch?v=YuCpTi0EtbU,Leonard Cohen - I'm Your Man (Live in Dublin - edited),LeonardCohenVEVO,29327957.0,113971.0,4612.0,"(C) 2014 Sony Music Entertainment.
Leonard Cohen's official video for his live performance of I'm Your Man. Click to listen to Leonard Cohen on Spotify: http://smarturl.it/LCspotifyGH  Click to listen to Live in Dublin on Apple Music: http://smarturl.it/LCDublinAM, Click to listen to Live in Dublin on Google Play Music: http://smarturl.it/LCDublinGoogle Buy the album/DVD Live in Dublin on Amazon: http://smarturl.it/LCDublinDVD

More videos from Leonard Cohen:
Travelling Light: https://www.youtube.com/watch?v=okaqX...
You Want It Darker - https://www.youtube.com/watch?v=YD6fv...
Suzanne - https://www.youtube.com/watch?v=n_56e...
First We Take Manhattan - https://www.youtube.com/watch?v=JTTC_...

Website: http://leonardcohen.com 
Facebook: https://www.facebook.com/leonardcohen

---------
Lyrics:
If you want a boxer
I will step into the ring for you
And if you want a doctor
I'll examine every inch of you
If you want a driver, climb inside
Or if you want to take me for a ride
You know you can
I'm your man""",True,True,34484692.0,rock music
